{"format_version": "2", "gcc_version": "14.2.0", "current_working_directory": "/home/runner/work/pyEDAA.Reports/pyEDAA.Reports/examples/Cpp/Catch2/build", "data_file": "CMakeFiles/app.dir/src/Counter.cpp.gcda", "files": [{"file": "/home/runner/work/pyEDAA.Reports/pyEDAA.Reports/examples/Cpp/Catch2/src/Counter.cpp", "functions": [{"name": "_ZN7CounterC2Ei", "demangled_name": "Counter::Counter(int)", "start_line": 6, "start_column": 1, "end_line": 6, "end_column": 49, "blocks": 1, "blocks_executed": 1, "execution_count": 7}, {"name": "_ZN7Counter5ValueEv", "demangled_name": "Counter::Value()", "start_line": 8, "start_column": 5, "end_line": 10, "end_column": 1, "blocks": 2, "blocks_executed": 2, "execution_count": 5}, {"name": "_ZN7Counter9IncrementEv", "demangled_name": "Counter::Increment()", "start_line": 12, "start_column": 5, "end_line": 17, "end_column": 1, "blocks": 8, "blocks_executed": 4, "execution_count": 3}, {"name": "_ZN7Counter9DecrementEv", "demangled_name": "Counter::Decrement()", "start_line": 19, "start_column": 5, "end_line": 24, "end_column": 1, "blocks": 8, "blocks_executed": 7, "execution_count": 3}, {"name": "_ZN7Counter5ResetEv", "demangled_name": "Counter::Reset()", "start_line": 26, "start_column": 6, "end_line": 28, "end_column": 1, "blocks": 1, "blocks_executed": 0, "execution_count": 0}], "lines": [{"line_number": 6, "function_name": "_ZN7CounterC2Ei", "count": 7, "unexecuted_block": false, "block_ids": [], "branches": [], "calls": [], "conditions": []}, {"line_number": 8, "function_name": "_ZN7Counter5ValueEv", "count": 5, "unexecuted_block": false, "block_ids": [], "branches": [], "calls": [], "conditions": []}, {"line_number": 9, "function_name": "_ZN7Counter5ValueEv", "count": 5, "unexecuted_block": false, "block_ids": [2], "branches": [], "calls": [], "conditions": []}, {"line_number": 12, "function_name": "_ZN7Counter9IncrementEv", "count": 3, "unexecuted_block": false, "block_ids": [], "branches": [], "calls": [], "conditions": []}, {"line_number": 13, "function_name": "_ZN7Counter9IncrementEv", "count": 3, "unexecuted_block": false, "block_ids": [2], "branches": [{"count": 0, "throw": false, "fallthrough": true, "source_block_id": 2, "destination_block_id": 3}, {"count": 3, "throw": false, "fallthrough": false, "source_block_id": 2, "destination_block_id": 6}], "calls": [], "conditions": []}, {"line_number": 14, "function_name": "_ZN7Counter9IncrementEv", "count": 0, "unexecuted_block": true, "block_ids": [3, 4, 5, 8], "branches": [{"count": 0, "throw": false, "fallthrough": true, "source_block_id": 4, "destination_block_id": 5}, {"count": 0, "throw": true, "fallthrough": false, "source_block_id": 4, "destination_block_id": 8}], "calls": [{"source_block_id": 3, "destination_block_id": 1, "returned": 0}, {"source_block_id": 4, "destination_block_id": 1, "returned": 0}, {"source_block_id": 5, "destination_block_id": 1, "returned": 0}, {"source_block_id": 8, "destination_block_id": 1, "returned": 0}], "conditions": []}, {"line_number": 16, "function_name": "_ZN7Counter9IncrementEv", "count": 3, "unexecuted_block": false, "block_ids": [6, 7], "branches": [], "calls": [], "conditions": []}, {"line_number": 19, "function_name": "_ZN7Counter9DecrementEv", "count": 3, "unexecuted_block": false, "block_ids": [], "branches": [], "calls": [], "conditions": []}, {"line_number": 20, "function_name": "_ZN7Counter9DecrementEv", "count": 3, "unexecuted_block": false, "block_ids": [2], "branches": [{"count": 2, "throw": false, "fallthrough": true, "source_block_id": 2, "destination_block_id": 3}, {"count": 1, "throw": false, "fallthrough": false, "source_block_id": 2, "destination_block_id": 6}], "calls": [], "conditions": []}, {"line_number": 21, "function_name": "_ZN7Counter9DecrementEv", "count": 2, "unexecuted_block": false, "block_ids": [3, 4, 5, 8], "branches": [{"count": 2, "throw": false, "fallthrough": true, "source_block_id": 4, "destination_block_id": 5}, {"count": 0, "throw": true, "fallthrough": false, "source_block_id": 4, "destination_block_id": 8}], "calls": [{"source_block_id": 3, "destination_block_id": 1, "returned": 2}, {"source_block_id": 4, "destination_block_id": 1, "returned": 2}, {"source_block_id": 5, "destination_block_id": 1, "returned": 0}, {"source_block_id": 8, "destination_block_id": 1, "returned": 0}], "conditions": []}, {"line_number": 23, "function_name": "_ZN7Counter9DecrementEv", "count": 1, "unexecuted_block": false, "block_ids": [6, 7], "branches": [], "calls": [], "conditions": []}, {"line_number": 26, "function_name": "_ZN7Counter5ResetEv", "count": 0, "unexecuted_block": true, "block_ids": [], "branches": [], "calls": [], "conditions": []}, {"line_number": 27, "function_name": "_ZN7Counter5ResetEv", "count": 0, "unexecuted_block": true, "block_ids": [], "branches": [], "calls": [], "conditions": []}, {"line_number": 28, "function_name": "_ZN7Counter5ResetEv", "count": 0, "unexecuted_block": true, "block_ids": [], "branches": [], "calls": [], "conditions": []}]}]}
