{"format_version": "2", "gcc_version": "15.2.0", "current_working_directory": "/home/runner/work/pyEDAA.Reports/pyEDAA.Reports/examples/Cpp/GoogleTest/build", "data_file": "CMakeFiles/app.dir/src/Counter.cpp.gcda", "files": [{"file": "/home/runner/work/pyEDAA.Reports/pyEDAA.Reports/examples/Cpp/GoogleTest/src/Counter.cpp", "functions": [{"name": "_ZN7Counter5ValueEv", "demangled_name": "Counter::Value()", "start_line": 3, "start_column": 5, "end_line": 5, "end_column": 1, "blocks": 2, "blocks_executed": 2, "execution_count": 4, "total_prime_paths": 0, "covered_prime_paths": 0, "prime_path_coverage": []}, {"name": "_ZN7Counter9IncrementEv", "demangled_name": "Counter::Increment()", "start_line": 7, "start_column": 5, "end_line": 9, "end_column": 1, "blocks": 2, "blocks_executed": 2, "execution_count": 1, "total_prime_paths": 0, "covered_prime_paths": 0, "prime_path_coverage": []}, {"name": "_ZN7Counter9DecrementEv", "demangled_name": "Counter::Decrement()", "start_line": 11, "start_column": 5, "end_line": 13, "end_column": 1, "blocks": 2, "blocks_executed": 2, "execution_count": 1, "total_prime_paths": 0, "covered_prime_paths": 0, "prime_path_coverage": []}], "lines": [{"line_number": 3, "function_name": "_ZN7Counter5ValueEv", "count": 4, "unexecuted_block": false, "block_ids": [], "branches": [], "calls": [], "conditions": []}, {"line_number": 4, "function_name": "_ZN7Counter5ValueEv", "count": 4, "unexecuted_block": false, "block_ids": [2], "branches": [], "calls": [], "conditions": []}, {"line_number": 7, "function_name": "_ZN7Counter9IncrementEv", "count": 1, "unexecuted_block": false, "block_ids": [], "branches": [], "calls": [], "conditions": []}, {"line_number": 8, "function_name": "_ZN7Counter9IncrementEv", "count": 1, "unexecuted_block": false, "block_ids": [2], "branches": [], "calls": [], "conditions": []}, {"line_number": 11, "function_name": "_ZN7Counter9DecrementEv", "count": 1, "unexecuted_block": false, "block_ids": [], "branches": [], "calls": [], "conditions": []}, {"line_number": 12, "function_name": "_ZN7Counter9DecrementEv", "count": 1, "unexecuted_block": false, "block_ids": [2], "branches": [], "calls": [], "conditions": []}]}]}
